{
  "schemaVersion": 1,
  "materialSetId": "openoita-core-v1",
  "worldConfig": "world_config.json",
  "materialsFile": "materials.json",
  "cells": [
    {
      "x": 11,
      "y": 11,
      "materialId": 101
    },
    {
      "x": 10,
      "y": 14,
      "materialId": 102
    },
    {
      "x": 11,
      "y": 14,
      "materialId": 102
    },
    {
      "x": 12,
      "y": 14,
      "materialId": 102
    },
    {
      "x": 10,
      "y": 15,
      "materialId": 102
    },
    {
      "x": 11,
      "y": 15,
      "materialId": 102
    },
    {
      "x": 12,
      "y": 15,
      "materialId": 102
    },
    {
      "x": 10,
      "y": 16,
      "materialId": 102
    },
    {
      "x": 11,
      "y": 16,
      "materialId": 102
    },
    {
      "x": 12,
      "y": 16,
      "materialId": 102
    }
  ],
  "fixedCells": [],
  "initialBurning": []
}
